nome,preco,classificado,categoria,site,data_raspagem
Verity,"R$ 25,38",#1,books,Amazon,2024-11-26 22:56:41
Conhecendo os Sons da Fazenda. Vaquinha,"R$ 22,99",#2,books,Amazon,2024-11-26 22:56:41
A hora da estrela: Edição comemorativa,"R$ 23,27",#3,books,Amazon,2024-11-26 22:56:42
Assistente do Vilão (Sucesso no TikTok),"R$ 25,44",#4,books,Amazon,2024-11-26 22:56:42
É assim que começa (Vol. 2 É assim que acaba),"R$ 28,41",#5,books,Amazon,2024-11-26 22:56:42
A Biblioteca da Meia-Noite,"R$ 30,64",#6,books,Amazon,2024-11-26 22:56:42
O Hobbit + pôster,"R$ 29,43",#7,books,Amazon,2024-11-26 22:56:42
Café com Deus Pai 2025: Porções Diárias de Transformação,"R$ 75,33",#8,books,Amazon,2024-11-26 22:56:42
Ainda estou aqui - O livro que deu origem ao filme,"R$ 57,51",#9,books,Amazon,2024-11-26 22:56:42
Aprendiz do Vilão,"R$ 29,35",#10,books,Amazon,2024-11-26 22:56:42
É Assim que Acaba: 1,"R$ 29,90",#11,books,Amazon,2024-11-26 22:56:43
"A psicologia financeira: lições atemporais sobre fortuna, ganância e felicidade","R$ 26,00",#12,books,Amazon,2024-11-26 22:56:43
A hipótese do amor,"R$ 29,13",#13,books,Amazon,2024-11-26 22:56:43
A paciente silenciosa,"R$ 28,44",#14,books,Amazon,2024-11-26 22:56:43
Cem anos de solidão,"R$ 29,90",#15,books,Amazon,2024-11-26 22:56:43
As coisas que você só vê quando desacelera: Como manter a calma em um mundo frenético,"R$ 30,86",#16,books,Amazon,2024-11-26 22:56:43
Nação dopamina: Por que o excesso de prazer está nos deixando infelizes e o que podemos fazer para mudar (leia também Nação tarja preta),"R$ 36,68",#17,books,Amazon,2024-11-26 22:56:43
Imperfeitos,"R$ 16,89",#18,books,Amazon,2024-11-26 22:56:43
Um dia muito mal-humorado,"R$ 19,00",#19,books,Amazon,2024-11-26 22:56:43
Essencialismo: A disciplinada busca por menos,"R$ 32,00",#20,books,Amazon,2024-11-26 22:56:44
Aurora: O despertar da mulher exausta,"R$ 20,64",#21,books,Amazon,2024-11-26 22:56:44
Oração para Desaparecer,"R$ 30,80",#22,books,Amazon,2024-11-26 22:56:44
Hábitos Atômicos: um Método Fácil e Comprovado de Criar Bons Hábitos e se Livrar dos Maus- Idioma : Português,"R$ 35,91",#23,books,Amazon,2024-11-26 22:56:44
Como fazer amigos e influenciar pessoas,"R$ 31,64",#24,books,Amazon,2024-11-26 22:56:44
O poder do subconsciente,"R$ 22,79",#25,books,Amazon,2024-11-26 22:56:44
O Deus que destrói sonhos,"R$ 20,90",#26,books,Amazon,2024-11-26 22:56:44
Manual Diagnóstico e Estatístico de Transtornos Mentais - DSM-5-TR: Texto Revisado,"R$ 190,73",#27,books,Amazon,2024-11-26 22:56:44
Melhor do que nos filmes,"R$ 34,90",#28,books,Amazon,2024-11-26 22:56:45
Perigoso!,"R$ 14,90",#29,books,Amazon,2024-11-26 22:56:45
Vai dar tudo certo,"R$ 23,59",#30,books,Amazon,2024-11-26 22:56:45
Memórias do subsolo,"R$ 21,69",#31,books,Amazon,2024-11-26 22:56:45
As 48 leis do poder: Edição concisa,"R$ 23,48",#32,books,Amazon,2024-11-26 22:56:45
Antes que o café esfrie: 1,"R$ 23,56",#33,books,Amazon,2024-11-26 22:56:45
Mulheres que correm com os lobos: Mitos e histórias do arquétipo da Mulher Selvagem,"R$ 41,36",#34,books,Amazon,2024-11-26 22:56:45
Fisher-Price - Kit Coleção Como é Bom,"R$ 29,78",#35,books,Amazon,2024-11-26 22:56:45
A cabeça do santo,"R$ 36,27",#36,books,Amazon,2024-11-26 22:56:46
Os sete maridos de Evelyn Hugo,"R$ 25,14",#37,books,Amazon,2024-11-26 22:56:46
Gatilhos Mentais: O Guia Completo com Estratégias de Negócios e Comunicações Provadas Para Você Aplicar,"R$ 25,70",#38,books,Amazon,2024-11-26 22:56:46
A geração ansiosa: Como a infância hiperconectada está causando uma epidemia de transtornos mentais,"R$ 48,90",#39,books,Amazon,2024-11-26 22:56:46
Eu e Esse meu Coração,"R$ 25,06",#40,books,Amazon,2024-11-26 22:56:46
Tudo é rio,"R$ 35,97",#41,books,Amazon,2024-11-26 22:56:46
Powerless: 1,"R$ 36,61",#42,books,Amazon,2024-11-26 22:56:46
Nada pode me ferir,"R$ 36,92",#43,books,Amazon,2024-11-26 22:56:46
A empregada (A empregada – Livro 1): Bem-vinda à família,"R$ 31,64",#44,books,Amazon,2024-11-26 22:56:47
"Amor, teoricamente","R$ 39,45",#45,books,Amazon,2024-11-26 22:56:47
Quebrando o hábito de ser você mesmo: Como reconstruir sua mente e criar um novo eu,"R$ 22,48",#46,books,Amazon,2024-11-26 22:56:47
O livro que você gostaria que seus pais tivessem lido: (e seus filhos ficarão gratos por você ler),"R$ 29,41",#47,books,Amazon,2024-11-26 22:56:47
Coisas óbvias sobre o amor (Vol. 2 Duologia laranja-forte*)+ ACOMPANHA BRINDES,"R$ 79,90",#48,books,Amazon,2024-11-26 22:56:47
Outlive: A arte e a ciência de viver mais e melhor,"R$ 40,72",#49,books,Amazon,2024-11-26 22:56:47
Princípios milenares: 10 leis espirituais para uma vida de paz e prosperidade,"R$ 36,41",#50,books,Amazon,2024-11-26 22:56:47
Uma vida pequena,"R$ 59,51",#51,books,Amazon,2024-11-26 22:57:07
Rápido e devagar: Duas formas de pensar,"R$ 40,47",#52,books,Amazon,2024-11-26 22:57:08
Véspera,"R$ 32,21",#53,books,Amazon,2024-11-26 22:57:08
Jantar secreto,"R$ 36,74",#54,books,Amazon,2024-11-26 22:57:08
Pequena coreografia do adeus,"R$ 30,90",#55,books,Amazon,2024-11-26 22:57:08
Quem soltou o pum?,"R$ 19,89",#56,books,Amazon,2024-11-26 22:57:08
Acolhendo sua criança interior: Uma abordagem inovadora para curar as feridas da infância,"R$ 30,49",#57,books,Amazon,2024-11-26 22:57:08
A revolução dos bichos: Um conto de fadas,"R$ 14,42",#58,books,Amazon,2024-11-26 22:57:08
Cartas de um diabo a seu aprendiz,"R$ 27,55",#59,books,Amazon,2024-11-26 22:57:09
Cleopatra e Frankenstein,"R$ 30,96",#60,books,Amazon,2024-11-26 22:57:09
#umdiasemreclamar: Descubra por que a gratidão pode mudar a sua vida,"R$ 24,74",#61,books,Amazon,2024-11-26 22:57:09
"Eu, meu pavio curto e Deus: Aprendendo a irar-se sem pecar","R$ 24,88",#62,books,Amazon,2024-11-26 22:57:09
"Chama de Ferro: sequência do fenômeno mundial Quarta Asa (Série O Empyriano, Livro 2)","R$ 57,00",#63,books,Amazon,2024-11-26 22:57:09
Onde Está a Bluey?: Um Livro de Esconde-Esconde,"R$ 14,29",#64,books,Amazon,2024-11-26 22:57:09
O lado feio do amor,"R$ 31,27",#65,books,Amazon,2024-11-26 22:57:09
Todas as suas (im)perfeições,"R$ 31,19",#66,books,Amazon,2024-11-26 22:57:10
A natureza da mordida,"R$ 31,72",#67,books,Amazon,2024-11-26 22:57:10
Olhos D'Água,"R$ 25,90",#68,books,Amazon,2024-11-26 22:57:10
"Pai Rico, pai Pobre: Edição de 20 Anos Atualizada e Ampliada","R$ 33,98",#69,books,Amazon,2024-11-26 22:57:10
Bem lá no alto,"R$ 25,59",#70,books,Amazon,2024-11-26 22:57:10
Coleção Especial Sherlock Holmes - Box com 6 livros,"R$ 45,68",#71,books,Amazon,2024-11-26 22:57:10
Quarta asa: 1,"R$ 54,53",#72,books,Amazon,2024-11-26 22:57:11
Em busca de mim,"R$ 26,58",#73,books,Amazon,2024-11-26 22:57:11
A insustentável leveza do ser,"R$ 33,69",#74,books,Amazon,2024-11-26 22:57:11
O corajoso pinguim,"R$ 17,20",#75,books,Amazon,2024-11-26 22:57:11
Sou péssimo em português,"R$ 16,24",#76,books,Amazon,2024-11-26 22:57:11
O Pequeno Príncipe (Original): Tradução original com aquarelas do autor,"R$ 9,68",#77,books,Amazon,2024-11-26 22:57:11
Suicidas,"R$ 33,40",#78,books,Amazon,2024-11-26 22:57:11
1984,"R$ 15,98",#79,books,Amazon,2024-11-26 22:57:12
Fisher-Price - Quando estou...,"R$ 14,24",#80,books,Amazon,2024-11-26 22:57:12
As mil partes do meu coração,"R$ 30,41",#81,books,Amazon,2024-11-26 22:57:12
Rei da Ira (Reis do Pecado – Livro 1),"R$ 29,45",#82,books,Amazon,2024-11-26 22:57:12
"Diário estoico: 366 lições sobre sabedoria, perseverança e a arte de viver","R$ 33,49",#83,books,Amazon,2024-11-26 22:57:12
O homem mais rico da Babilônia,"R$ 23,41",#84,books,Amazon,2024-11-26 22:57:12
Coraline: Acompanha marcador de páginas especial,"R$ 36,55",#85,books,Amazon,2024-11-26 22:57:13
Leitura de verão,"R$ 25,64",#86,books,Amazon,2024-11-26 22:57:13
Box Clássicos de William Shakespeare - com 7 marcadores de páginas,"R$ 46,95",#87,books,Amazon,2024-11-26 22:57:13
Violeta,"R$ 27,95",#88,books,Amazon,2024-11-26 22:57:13
Baleia na banheira,"R$ 24,79",#89,books,Amazon,2024-11-26 22:57:13
Os segredos da mente milionária: Aprenda a enriquecer mudando seus conceitos sobre o dinheiro e adotando os hábitos das pessoas bem-sucedidas,"R$ 31,74",#90,books,Amazon,2024-11-26 22:57:13
Enquanto Ana espera,"R$ 38,95",#91,books,Amazon,2024-11-26 22:57:14
As armas da persuasão: Como influenciar e não se deixar influenciar,"R$ 33,36",#92,books,Amazon,2024-11-26 22:57:14
Primeiro eu tive que morrer: Romance,"R$ 27,60",#93,books,Amazon,2024-11-26 22:57:14
Alice no País das Maravilhas (Classic Edition),"R$ 35,83",#94,books,Amazon,2024-11-26 22:57:14
Sapiens (Nova edição): Uma breve história da humanidade,"R$ 35,99",#95,books,Amazon,2024-11-26 22:57:14
As obras revolucionárias de George Orwell - Box com 3 livros,"R$ 22,34",#96,books,Amazon,2024-11-26 22:57:14
Vou te receitar um gato,"R$ 28,50",#97,books,Amazon,2024-11-26 22:57:15
O velho e o mar,"R$ 27,07",#98,books,Amazon,2024-11-26 22:57:15
Macaco danado,"R$ 28,45",#99,books,Amazon,2024-11-26 22:57:15
O diário de uma princesa desastrada 3: A maldição das princesas,"R$ 48,79",#100,books,Amazon,2024-11-26 22:57:15
